<?xml version="1.0" encoding="UTF-8"?>
<!--

    Copyright (C) 2012 Mirko Jahn <mirkojahn@gmail.com>

    Licensed under the Apache License, Version 2.0 (the "License");
    you may not use this file except in compliance with the License.
    You may obtain a copy of the License at

            http://www.apache.org/licenses/LICENSE-2.0

    Unless required by applicable law or agreed to in writing, software
    distributed under the License is distributed on an "AS IS" BASIS,
    WITHOUT WARRANTIES OR CONDITIONS OF ANY KIND, either express or implied.
    See the License for the specific language governing permissions and
    limitations under the License.

-->
<config  xmlns="http://com.cibuddy.project.configuration/schema/behavior/v1-0" 
         xmlns:xs="http://www.w3.org/2001/XMLSchema-instance" 
         xmlns:xsi="http://www.w3.org/2001/XMLSchema-instance"
         xsi:schemaLocation='http://com.cibuddy.project.configuration/schema/behavior/v1-0 ../../main/resources/indicator-1.0.xsd'
         name="default">
    <action condition="all">
        <status>blue</status>
        <status>blue_anime</status>
        <indicate>success</indicate>
    </action>
    <action condition="1:*"><!-- at least one -->
        <status>red</status>
        <status>red_anime</status>
        <indicate>failure</indicate>
    </action>
    <action condition="1:*"><!-- at least one -->
        <status>yellow</status>
        <status>yellow_anime</status>
        <indicate>warning</indicate>
    </action>
    <action condition="default"><!-- catch all -->
        <indicate>off</indicate>
    </action>
</config>